{
    "$schema": "https://json-schema.org/draft/2019-09/schema",
    "type": "array",
    "items": {
        "type": "object",
        "properties": {
            "name": {"type":"string"},
            "email": {"type": "string"},
            "subject": {"type": "string"},
            "message": {"type": "string"}
        },
        "required": ["name", "email", "subject", "message"],
        "additionalProperties": true
    }
}