[
  {
    "name": "Monkey D. Luffy",
    "email": "luffy@example.com",
    "subject": "Membership Question",
    "message": "Hi, can I join the gym even if my schedule is not fixed every week?"
  },
  {
    "name": "Roronoa Zoro",
    "email": "zoro@example.com",
    "subject": "Training Hours",
    "message": "What time does the gym open in the morning? I usually train very early."
  },
  {
    "name": "Nami",
    "email": "nami@example.com",
    "subject": "Pricing Inquiry",
    "message": "I would like to know more about membership prices and monthly promotions."
  },
  {
    "name": "Usopp",
    "email": "usopp@example.com",
    "subject": "Beginner Program",
    "message": "Do you have any gym programs suitable for beginners who rarely exercise?"
  },
  {
    "name": "Sanji",
    "email": "sanji@example.com",
    "subject": "Facilities",
    "message": "Is there a locker room and shower available for members after workout?"
  },
  {
    "name": "Tony Tony Chopper",
    "email": "chopper@example.com",
    "subject": "Health Concern",
    "message": "I have a minor injury. Do you offer light training or consultation?"
  },
  {
    "name": "Nico Robin",
    "email": "robin@example.com",
    "subject": "Personal Trainer",
    "message": "Are personal trainers available, and how can I book a training session?"
  },
  {
    "name": "Franky",
    "email": "franky@example.com",
    "subject": "Equipment Question",
    "message": "What kind of weightlifting equipment do you have in your gym?"
  },
  {
    "name": "Brook",
    "email": "brook@example.com",
    "subject": "Membership Duration",
    "message": "Can I register for a short-term membership, like one or two months?"
  },
  {
    "name": "Jinbe",
    "email": "jinbe@example.com",
    "subject": "Class Schedule",
    "message": "Do you offer group classes such as cardio or strength training sessions?"
  },

  {
    "name": "Trafalgar Law",
    "email": "law@example.com",
    "subject": "Account Issue",
    "message": "I had trouble logging into my membership account. Can you help?"
  },
  {
    "name": "Eustass Kid",
    "email": "kid@example.com",
    "subject": "Gym Rules",
    "message": "Are there specific rules regarding equipment usage during peak hours?"
  },
  {
    "name": "Killer",
    "email": "killer@example.com",
    "subject": "Trainer Availability",
    "message": "Is there always a trainer on duty, especially during evening hours?"
  },
  {
    "name": "Shanks",
    "email": "shanks@example.com",
    "subject": "Membership Transfer",
    "message": "Can a membership be transferred to another person if I move away?"
  },
  {
    "name": "Benn Beckman",
    "email": "beckman@example.com",
    "subject": "Long-Term Plan",
    "message": "Do you offer discounted plans for long-term memberships?"
  },
  {
    "name": "Dracule Mihawk",
    "email": "mihawk@example.com",
    "subject": "Private Training",
    "message": "Is it possible to train privately without participating in group sessions?"
  },
  {
    "name": "Boa Hancock",
    "email": "hancock@example.com",
    "subject": "Women Facilities",
    "message": "Do you provide separate facilities or schedules for female members?"
  },
  {
    "name": "Croco d ile",
    "email": "crocodile@example.com",
    "subject": "Cancellation Policy",
    "message": "What is the policy if I need to cancel my membership midway?"
  },
  {
    "name": "Donquixote Doflamingo",
    "email": "doflamingo@example.com",
    "subject": "Feedback",
    "message": "Overall the gym is great, but I think the parking area could be improved."
  },
  {
    "name": "Bartholomew Kuma",
    "email": "kuma@example.com",
    "subject": "Accessibility",
    "message": "Is the gym accessible for members with physical limitations?"
  },

  {
    "name": "Gol D. Roger",
    "email": "roger@example.com",
    "subject": "Legacy Membership",
    "message": "Do you have special memberships for senior members or veterans?"
  },
  {
    "name": "Edward Newgate",
    "email": "whitebeard@example.com",
    "subject": "Family Plan",
    "message": "Is there a family membership plan available?"
  },
  {
    "name": "Marco",
    "email": "marco@example.com",
    "subject": "Trainer Certification",
    "message": "Are your trainers certified and experienced in injury prevention?"
  },
  {
    "name": "Ace",
    "email": "ace@example.com",
    "subject": "Trial Session",
    "message": "Can I try a one-day pass before committing to a full membership?"
  },
  {
    "name": "Sabo",
    "email": "sabo@example.com",
    "subject": "Operating Days",
    "message": "Are you open on public holidays or Sundays?"
  },
  {
    "name": "Smoker",
    "email": "smoker@example.com",
    "subject": "Locker Safety",
    "message": "How secure are the lockers for personal belongings?"
  },
  {
    "name": "Tashigi",
    "email": "tashigi@example.com",
    "subject": "Beginner Guidance",
    "message": "Do trainers help beginners understand proper form and techniques?"
  },
  {
    "name": "Garp",
    "email": "garp@example.com",
    "subject": "Senior Training",
    "message": "Do you have training programs designed for older members?"
  },
  {
    "name": "Koby",
    "email": "koby@example.com",
    "subject": "Confidence Training",
    "message": "I am new to the gym environment and feel a bit nervous. Any advice?"
  },
  {
    "name": "Helmeppo",
    "email": "helmeppo@example.com",
    "subject": "Payment Method",
    "message": "What payment methods do you accept for membership fees?"
  },
  
{
    "name": "Charlotte Katakuri",
    "email": "katakuri@example.com",
    "subject": "Training Intensity",
    "message": "Is there a high-intensity workout program suitable for advanced athletes?"
  },
  {
    "name": "Big Mom",
    "email": "bigmom@example.com",
    "subject": "Facility Complaint",
    "message": "The music volume during peak hours feels a bit too low. Can it be adjusted?"
  },
  {
    "name": "Kaido",
    "email": "kaido@example.com",
    "subject": "Heavy Equipment",
    "message": "Do you have equipment designed for heavy strength training?"
  },
  {
    "name": "King",
    "email": "king@example.com",
    "subject": "Personal Space",
    "message": "Is there a private area for focused training without disturbance?"
  },
  {
    "name": "Queen",
    "email": "queen@example.com",
    "subject": "Music Playlist",
    "message": "Can members request specific music playlists during workouts?"
  },
  {
    "name": "Jack",
    "email": "jack@example.com",
    "subject": "Crowded Hours",
    "message": "Which hours are usually the least crowded for training?"
  },
  {
    "name": "Yamato",
    "email": "yamato@example.com",
    "subject": "Membership Extension",
    "message": "How can I extend my membership before it expires?"
  },
  {
    "name": "Oden Kozuki",
    "email": "oden@example.com",
    "subject": "Training Philosophy",
    "message": "Do your trainers follow a specific training philosophy or style?"
  },
  {
    "name": "Kinemon",
    "email": "kinemon@example.com",
    "subject": "Locker Access",
    "message": "Can lockers be accessed outside of training hours?"
  },
  {
    "name": "Raizo",
    "email": "raizo@example.com",
    "subject": "Flexibility Training",
    "message": "Do you offer flexibility or mobility-focused training sessions?"
  },

  {
    "name": "Buggy",
    "email": "buggy@example.com",
    "subject": "Accidental Payment",
    "message": "I accidentally paid twice for my membership. How can I get a refund?"
  },
  {
    "name": "Alvida",
    "email": "alvida@example.com",
    "subject": "Changing Schedule",
    "message": "Can I switch training schedules after registering?"
  },
  {
    "name": "Kuro",
    "email": "kuro@example.com",
    "subject": "Silent Zone",
    "message": "Is there any quiet area for stretching or cooldown?"
  },
  {
    "name": "Arlong",
    "email": "arlong@example.com",
    "subject": "Pool Facility",
    "message": "Do you have any swimming or aquatic workout facilities?"
  },
  {
    "name": "Hody Jones",
    "email": "hody@example.com",
    "subject": "Night Access",
    "message": "Are there any late-night or 24-hour access options?"
  },
  {
    "name": "Fisher Tiger",
    "email": "tiger@example.com",
    "subject": "Community Event",
    "message": "Does the gym organize community fitness events or challenges?"
  },
  {
    "name": "Enel",
    "email": "enel@example.com",
    "subject": "Electric Safety",
    "message": "Are electronic devices allowed during workouts?"
  },
  {
    "name": "Urouge",
    "email": "urouge@example.com",
    "subject": "Recovery Program",
    "message": "Do you have any recovery or rest programs after intense training?"
  },
  {
    "name": "Apoo",
    "email": "apoo@example.com",
    "subject": "Music Feedback",
    "message": "The sound system is great. Thanks for the energetic vibe!"
  },
  {
    "name": "X Drake",
    "email": "drake@example.com",
    "subject": "Trainer Background",
    "message": "Can I get information about the trainers' professional background?"
  },

  {
    "name": "Rob Lucci",
    "email": "lucci@example.com",
    "subject": "Strict Training",
    "message": "Do you allow strict, no-distraction training sessions?"
  },
  {
    "name": "Kaku",
    "email": "kaku@example.com",
    "subject": "Stretching Area",
    "message": "Is there enough space dedicated just for stretching?"
  },
  {
    "name": "Spandam",
    "email": "spandam@example.com",
    "subject": "Rule Clarification",
    "message": "Can you clarify gym rules for equipment reservation?"
  },
  {
    "name": "Blueno",
    "email": "blueno@example.com",
    "subject": "Peak Time Access",
    "message": "Is access limited during peak hours?"
  },
  {
    "name": "Sengoku",
    "email": "sengoku@example.com",
    "subject": "Management Feedback",
    "message": "Overall management feels solid. Keep the good work."
  },
  {
    "name": "Akainu",